### ISSUE TITLE
Failed to pull and unpack image, error on AWS EKS.

### ISSUE THREAD

**Issue by yo-l1982** [aceeric/ociregistry#18]
Hello!
Im trying out this project on my EKS cluster running Bottlerocket OS.

Locally it works just fine but i get this error message from containerd when I run it in EKS.

`Back-off pulling image "gcr.io/istio-release/install-cni:1.27.3-distroless": ErrImagePull: rpc error: code = FailedPrecondition desc = failed to pull and unpack image "gcr.io/istio-release/install-cni:1.27.3-distroless": failed commit on ref "layer-sha256:18a5ece22d1dede14bbfedfc8eead0ca42eaebfdb9c8923b702a0dfa05a97ac7": "layer-sha256:18a5ece22d1dede14bbfedfc8eead0ca42eaebfdb9c8923b702a0dfa05a97ac7" failed size validation: 25165824 != 18802122: failed precondition`

This is just one of the images, it get similar error on all images I try to pull.

I kind of hit the wall debugging this.
Do you have any idea what could be wrong here or how to debug it further?

**Comment by aceeric** [comment]
When you say locally I'm going to guess that you mean just running the server on your desktop and pulling through it...

Did you see anything in the ociregistry logs?

Here is my setup - how I use the server:

1. I run the server on my Ubuntu desktop as a systemd service. So:
```
$ systemctl status ociregistry
● ociregistry.service - ociregistry
     Loaded: loaded (/etc/systemd/system/ociregistry.service; enabled; preset: enabled)
     Active: active (running) since Wed 2025-10-08 19:40:19 EDT; 2 weeks 0 days ago
       Docs: https://github.com/aceeric/ociregistry
   Main PID: 1787 (ociregistry-ser)
      Tasks: 15 (limit: 76782)
     Memory: 1.3G (peak: 1.3G)
        CPU: 9.176s
     CGroup: /system.slice/ociregistry.service
             └─1787  --image-path=/var/lib/ociregistry/images --log-level=info serve
```
and:
```
$ /bin/ociregistry-server version
ociregistry version: 1.9.6 build date: 2025-10-06T23:35:46.56Z
```
2. I run Kubernetes also on my desktop in VMs using KVM on Linux. So I have a three node cluster with each node being a VM on my desktop. Each node has `containerd` configured to mirror to the ociregistry systemd service on my desktop.

So here is what I just now did:

1. I just ssh'd into one of the cluster VMs and in the VM here is how containerd is set up to mirror. This mirrors *all* image pulls to the ociregistry pull-thru server:
```
[root@vm1 ~]# cat /etc/containerd/certs.d/_default/hosts.toml 
[host."http://192.168.0.49:8080"]
  capabilities = ["pull", "resolve"]
  skip_verify = true
```
2. The `192.168.0.49` is my desktop running ociregistry server. Again inside the VM:
```
[root@vm1 ~]# crictl images
IMAGE                                                    TAG                 IMAGE ID            SIZE
docker.io/kubernetesui/dashboard-auth                    1.2.4               096fddada27ad       14.4MB
docker.io/kubernetesui/dashboard-metrics-scraper         1.2.2               d9cbc9f4053ca       13MB
quay.io/cilium/cilium-envoy                              <none>              ebcf7d5ca03c4       64.5MB
quay.io/cilium/cilium                                    <none>              59d2eae9f28d8       271MB
quay.io/cilium/operator-generic                          <none>              70237538a05d7       33.6MB
quay.io/jetstack/cert-manager-webhook                    v1.17.2             f95659b9aa1a2       18.7MB
quay.io/prometheus-operator/prometheus-config-reloader   v0.82.2             2c4cbdfabb2ef       14.7MB
quay.io/prometheus/alertmanager                          v0.28.1             91c01b3cec9b5       35MB
quay.io/prometheus/node-exporter                         v1.9.1              255ec253085fb       13MB
registry.k8s.io/ingress-nginx/controller                 <none>              3d5c6a600b312       105MB
registry.k8s.io/kube-state-metrics/kube-state-metrics    v2.15.0             8650a5270cac2       15.3MB
registry.k8s.io/pause                                    3.8                 4873874c08efc       311kB
```
3. Then still in the VM:
```
[root@vm1 ~]# crictl pull gcr.io/istio-release/install-cni:1.27.3-distroless
Image is up to date for sha256:9d9c307e9a7367cfd05f75d910ef9ccfeb6b4d1e02b1b5656a3a25f02423eb54
```
4. Then (again) in the VM, I see the image was pulled
```
[root@vm1 ~]# crictl images
IMAGE                                                    TAG                 IMAGE ID            SIZE
docker.io/kubernetesui/dashboard-auth                    1.2.4               096fddada27ad       14.4MB
docker.io/kubernetesui/dashboard-metrics-scraper         1.2.2               d9cbc9f4053ca       13MB
gcr.io/istio-release/install-cni                         1.27.3-distroless   9d9c307e9a736       47.7MB <<< NEW
quay.io/cilium/cilium-envoy                              <none>              ebcf7d5ca03c4       64.5MB
quay.io/cilium/cilium                                    <none>              59d2eae9f28d8       271MB
quay.io/cilium/operator-generic                          <none>              70237538a05d7       33.6MB
quay.io/jetstack/cert-manager-webhook                    v1.17.2             f95659b9aa1a2       18.7MB
quay.io/prometheus-operator/prometheus-config-reloader   v0.82.2             2c4cbdfabb2ef       14.7MB
quay.io/prometheus/alertmanager                          v0.28.1             91c01b3cec9b5       35MB
quay.io/prometheus/node-exporter                         v1.9.1              255ec253085fb       13MB
registry.k8s.io/ingress-nginx/controller                 <none>              3d5c6a600b312       105MB
registry.k8s.io/kube-state-metrics/kube-state-metrics    v2.15.0             8650a5270cac2       15.3MB
registry.k8s.io/pause                                    3.8                 4873874c08efc       311kB
```
5. Check containerd version in the VM
```
[root@vm1 ~]# containerd --version
containerd github.com/containerd/containerd/v2 v2.1.4 75cb2b7193e4e490e9fbdc236c0e811ccaba3376
```
6. Containerd logs in the VM
```
journalctl -u containerd
...
Oct 23 17:38:01 vm1 containerd[671]: time="2025-10-23T17:38:01.931851640-04:00" level=info msg="PullImage \"gcr.io/istio-release/install-cni:1.27.3-distroless\""
Oct 23 17:38:01 vm1 containerd[671]: time="2025-10-23T17:38:01.935231776-04:00" level=info msg="host will try HTTPS first since it is configured for HTTP with a TLS configuration, consider changing hos>
Oct 23 17:38:02 vm1 containerd[671]: time="2025-10-23T17:38:02.917896117-04:00" level=info msg="host will try HTTPS first since it is configured for HTTP with a TLS configuration, consider changing hos>
Oct 23 17:38:07 vm1 containerd[671]: time="2025-10-23T17:38:07.247632196-04:00" level=info msg="ImageCreate event name:\"gcr.io/istio-release/install-cni:1.27.3-distroless\" labels:{key:\"io.cri-contai>
Oct 23 17:38:07 vm1 containerd[671]: time="2025-10-23T17:38:07.249651540-04:00" level=info msg="stop pulling image gcr.io/istio-release/install-cni:1.27.3-distroless: active requests=0, bytes read=4251>
Oct 23 17:38:07 vm1 containerd[671]: time="2025-10-23T17:38:07.251981478-04:00" level=info msg="ImageCreate event name:\"sha256:9d9c307e9a7367cfd05f75d910ef9ccfeb6b4d1e02b1b5656a3a25f02423eb54\" labels>
Oct 23 17:38:07 vm1 containerd[671]: time="2025-10-23T17:38:07.254682515-04:00" level=info msg="ImageCreate event name:\"gcr.io/istio-release/install-cni@sha256:cfe35258547be35aed2f3c94b56949d5460c0dd3>
Oct 23 17:38:07 vm1 containerd[671]: time="2025-10-23T17:38:07.255451877-04:00" level=info msg="Pulled image \"gcr.io/istio-release/install-cni:1.27.3-distroless\" with image id \"sha256:9d9c307e9a7367>
Oct 23 17:38:07 vm1 containerd[671]: time="2025-10-23T17:38:07.255475323-04:00" level=info msg="PullImage \"gcr.io/istio-release/install-cni:1.27.3-distroless\" returns image reference \"sha256:9d9c307>
...
```
7. Back on my Ubuntu desktop, `ociregistry` logs (proves ociregistry pulled successfully)
```
journalctl -u ociregistry

Oct 23 17:38:01 ubuntu-desktop ociregistry-server[1787]: time="2025-10-23T17:38:01-04:00" level=info msg="pulling manifest from upstream: \"gcr.io/istio-release/install-cni:1.27.3-distroless\""
Oct 23 17:38:02 ubuntu-desktop ociregistry-server[1787]: time="2025-10-23T17:38:02-04:00" level=info msg="echo server HEAD:/v2/istio-release/install-cni/manifests/1.27.3-distroless?ns=gcr.io status=200 latency=979.755295ms host=192.168.0.49:8080 ip=192.168.122.69"
Oct 23 17:38:02 ubuntu-desktop ociregistry-server[1787]: time="2025-10-23T17:38:02-04:00" level=info msg="serving manifest from cache: \"gcr.io/istio-release/install-cni@sha256:cfe35258547be35aed2f3c94b56949d5460c0dd3810b94a16d3310c7e9337e62\""
Oct 23 17:38:02 ubuntu-desktop ociregistry-server[1787]: time="2025-10-23T17:38:02-04:00" level=info msg="echo server GET:/v2/istio-release/install-cni/manifests/sha256:cfe3525854?ns=gcr.io status=200 latency=409.276µs host=192.168.0.49:8080 ip=192.168.122.69"
Oct 23 17:38:02 ubuntu-desktop ociregistry-server[1787]: time="2025-10-23T17:38:02-04:00" level=info msg="pulling manifest from upstream: \"gcr.io/istio-release/install-cni@sha256:9fcef23aed64923207ded5995afbd5728e6a9fd25c8dc16dc8fdf3563f16afd5\""
Oct 23 17:38:06 ubuntu-desktop ociregistry-server[1787]: time="2025-10-23T17:38:06-04:00" level=info msg="echo server GET:/v2/istio-release/install-cni/manifests/sha256:9fcef23aed?ns=gcr.io status=200 latency=3.309165254s host=192.168.0.49:8080 ip=192.168.122.69"
Oct 23 17:38:06 ubuntu-desktop ociregistry-server[1787]: time="2025-10-23T17:38:06-04:00" level=info msg="echo server GET:/v2/istio-release/install-cni/blobs/sha256:9d9c307e9a?ns=gcr.io status=200 latency=325.591µs host=192.168.0.49:8080 ip=192.168.122.69"
Oct 23 17:38:06 ubuntu-desktop ociregistry-server[1787]: time="2025-10-23T17:38:06-04:00" level=info msg="echo server GET:/v2/istio-release/install-cni/blobs/sha256:89732bc750?ns=gcr.io status=200 latency=420.032µs host=192.168.0.49:8080 ip=192.168.122.69"
Oct 23 17:38:06 ubuntu-desktop ociregistry-server[1787]: time="2025-10-23T17:38:06-04:00" level=info msg="echo server GET:/v2/istio-release/install-cni/blobs/sha256:1ea895fc11?ns=gcr.io status=200 latency=34.531191ms host=192.168.0.49:8080 ip=192.168.122.69"
Oct 23 17:38:06 ubuntu-desktop ociregistry-server[1787]: time="2025-10-23T17:38:06-04:00" level=info msg="echo server GET:/v2/istio-release/install-cni/blobs/sha256:18a5ece22d?ns=gcr.io status=200 latency=63.949635ms host=192.168.0.49:8080 ip=192.168.122.69"
Oct 23 17:38:06 ubuntu-desktop ociregistry-server[1787]: time="2025-10-23T17:38:06-04:00" level=info msg="echo server GET:/v2/istio-release/install-cni/blobs/sha256:410847c689?ns=gcr.io status=200 latency=99.544164ms host=192.168.0.49:8080 ip=192.168.122.69"
```

Here are the things I can think to try:
1. Can you make containerd a more recent version in your cluster?
2. Are you running ociregistry over plain HTTP? If not, can you run it that way?
3. Can you docker pull the image through ociregistry and then docker run it? (In other words exclude containerd)?
4. Can you docker pull the image directly from a cluster VM without pulling through the registry?
5. Can you temporarily un-mirror containerd and then crictl pull the image to take ociregistry out of the equation as a factor

The only other thing I can think of is: since you're running on EKS bottlerocket, the image you're pulling down will be different than the one I am pulling because I'm running inside a VM on Alma 9 Linux and the ociregistry server provides images suitable for the client - containerd in this case - based on the image and layer digest its asked to serve.

So containerd is saying (to ociregistry) "give me the manifest list for "gcr.io/istio-release/install-cni:1.27.3-distroless" and then "give me the image manifest and blobs for bottlerocket". In order for me to reproduce this I'd need to stand up an EKS/bottlerocket cluster... Which I can do. But since you already have a cluster up you can try some things.

In summary, I would try these inside the bottlerocket VM

1. crictl > containerd > ociregistry > ghcr (we know this doesnt work)
   e.g. crictl pull gcr.io/istio-release/install-cni:1.27.3-distroless
2. crictl > containerd > ghcr (try without containerd mirroring)
3. docker client > ociregistry > ghcr (try docker client directory through ociregistry server)
   e.g. docker pull ociregistryhostname:8080/gcr.io/istio-release/install-cni:1.27.3-distroless
4. docker client > ghcr (try direct without the pull-thru server)
   e.g. docker pull gcr.io/istio-release/install-cni:1.27.3-distroless)

If nothing yields success I can spin up a small EKS/bottlerocket cluster and see if I can get any insight but on initial blush it seems to be:
1. The version of ociregistry
2. The version of containerd
3. The install-cni image for the bottlerocket distro (again - depending on where containerd is running you get a completely different set of layers based on the OS running containerd (Alma in my case.)

**Comment by aceeric** [comment]
More troubleshooting you can do - if you inspect the ociregistry image store as I did just now you should see the following. As you see above the digest for the linux/amd64 image manifest is `9fcef23a...`. So:
```
$ cat /var/lib/ociregistry/images/img/9fcef23aed64923207ded5995afbd5728e6a9fd25c8dc16dc8fdf3563f16afd5  | jq
```
result:
```
    ...
    "layers": [
      {
      ...
        "mediaType": "application/vnd.docker.image.rootfs.diff.tar.gzip",
        "digest": "sha256:18a5ece22d1dede14bbfedfc8eead0ca42eaebfdb9c8923b702a0dfa05a97ac7",
        "size": 18802122
      },
      ...
```
And the blob for `18a5ece2...` that your containerd is complaining about:
```
$ ls -l /var/lib/ociregistry/images/blobs/18a5ece22d1dede14bbfedfc8eead0ca42eaebfdb9c8923b702a0dfa05a97ac7 
-rw-r--r-- 1 root root 18802122 Oct 23 17:38 /var/lib/ociregistry/images/blobs/18a5ece22d1dede14bbfedfc8eead0ca42eaebfdb9c8923b702a0dfa05a97ac7
```
And you can see it is `18802122` bytes on disk as it in in the layers array of the manifest. Wondering if you can reproduce those results in the ociregistry directories

**Comment by aceeric** [comment]
Oh wow thank you. I can try the concurrent layer fetch setting myself and see if I can surface the issue here.

**Comment by yo-l1982** [comment]
Some more info.
The setting adds a `Range: bytes=n`header to the request that increments by the set value in `concurrent_layer_fetch_buffer` 8388608

With concurrent_layer_fetch_buffer set:
```
Frame 21: Packet, 405 bytes on wire (3240 bits), 405 bytes captured (3240 bits) on interface lo, id 0
Ethernet II, Src: 00:00:00_00:00:00 (00:00:00:00:00:00), Dst: 00:00:00_00:00:00 (00:00:00:00:00:00)
Internet Protocol Version 6, Src: ::1, Dst: ::1
Transmission Control Protocol, Src Port: 42906, Dst Port: 8080, Seq: 974, Ack: 7144, Len: 319
Hypertext Transfer Protocol
    GET /v2/registry.k8s.io/kube-scheduler/blobs/sha256:6523efc24f16435b7507a67c2a1f21828c9d58531902856b294bf49d04b96bbe HTTP/1.1\r\n
        Request Method: GET
        Request URI: /v2/registry.k8s.io/kube-scheduler/blobs/sha256:6523efc24f16435b7507a67c2a1f21828c9d58531902856b294bf49d04b96bbe
        Request Version: HTTP/1.1
    Host: localhost:8080\r\n
    User-Agent: containerd/v2.1.4\r\n
    Accept: application/vnd.docker.image.rootfs.diff.tar.gzip, */*\r\n
    Accept-Encoding: zstd;q=1.0, gzip;q=0.8, deflate;q=0.5\r\n
    Range: bytes=0-\r\n
    \r\n
    [Full request URI: http://localhost:8080/v2/registry.k8s.io/kube-scheduler/blobs/sha256:6523efc24f16435b7507a67c2a1f21828c9d58531902856b294bf49d04b96bbe]


Frame 39: Packet, 411 bytes on wire (3288 bits), 411 bytes captured (3288 bits) on interface lo, id 0
Ethernet II, Src: 00:00:00_00:00:00 (00:00:00:00:00:00), Dst: 00:00:00_00:00:00 (00:00:00:00:00:00)
Internet Protocol Version 6, Src: ::1, Dst: ::1
Transmission Control Protocol, Src Port: 42922, Dst Port: 8080, Seq: 1, Ack: 1, Len: 325
Hypertext Transfer Protocol
    GET /v2/registry.k8s.io/kube-scheduler/blobs/sha256:6523efc24f16435b7507a67c2a1f21828c9d58531902856b294bf49d04b96bbe HTTP/1.1\r\n
        Request Method: GET
        Request URI: /v2/registry.k8s.io/kube-scheduler/blobs/sha256:6523efc24f16435b7507a67c2a1f21828c9d58531902856b294bf49d04b96bbe
        Request Version: HTTP/1.1
    Host: localhost:8080\r\n
    User-Agent: containerd/v2.1.4\r\n
    Accept: application/vnd.docker.image.rootfs.diff.tar.gzip, */*\r\n
    Accept-Encoding: zstd;q=1.0, gzip;q=0.8, deflate;q=0.5\r\n
    Range: bytes=8388608-\r\n
    \r\n
    [Full request URI: http://localhost:8080/v2/registry.k8s.io/kube-scheduler/blobs/sha256:6523efc24f16435b7507a67c2a1f21828c9d58531902856b294bf49d04b96bbe]

Frame 37: Packet, 412 bytes on wire (3296 bits), 412 bytes captured (3296 bits) on interface lo, id 0
Ethernet II, Src: 00:00:00_00:00:00 (00:00:00:00:00:00), Dst: 00:00:00_00:00:00 (00:00:00:00:00:00)
Internet Protocol Version 6, Src: ::1, Dst: ::1
Transmission Control Protocol, Src Port: 42914, Dst Port: 8080, Seq: 1, Ack: 1, Len: 326
Hypertext Transfer Protocol
    GET /v2/registry.k8s.io/kube-scheduler/blobs/sha256:6523efc24f16435b7507a67c2a1f21828c9d58531902856b294bf49d04b96bbe HTTP/1.1\r\n
        Request Method: GET
        Request URI: /v2/registry.k8s.io/kube-scheduler/blobs/sha256:6523efc24f16435b7507a67c2a1f21828c9d58531902856b294bf49d04b96bbe
        Request Version: HTTP/1.1
    Host: localhost:8080\r\n
    User-Agent: containerd/v2.1.4\r\n
    Accept: application/vnd.docker.image.rootfs.diff.tar.gzip, */*\r\n
    Accept-Encoding: zstd;q=1.0, gzip;q=0.8, deflate;q=0.5\r\n
    Range: bytes=16777216-\r\n
    \r\n
    [Full request URI: http://localhost:8080/v2/registry.k8s.io/kube-scheduler/blobs/sha256:6523efc24f16435b7507a67c2a1f21828c9d58531902856b294bf49d04b96bbe]

```
Without concurrent_layer_fetch_buffer set:
```
Frame 21: Packet, 388 bytes on wire (3104 bits), 388 bytes captured (3104 bits) on interface lo, id 0
Ethernet II, Src: 00:00:00_00:00:00 (00:00:00:00:00:00), Dst: 00:00:00_00:00:00 (00:00:00:00:00:00)
Internet Protocol Version 6, Src: ::1, Dst: ::1
Transmission Control Protocol, Src Port: 39892, Dst Port: 8080, Seq: 923, Ack: 7144, Len: 302
Hypertext Transfer Protocol
    GET /v2/registry.k8s.io/kube-scheduler/blobs/sha256:6523efc24f16435b7507a67c2a1f21828c9d58531902856b294bf49d04b96bbe HTTP/1.1\r\n
        Request Method: GET
        Request URI: /v2/registry.k8s.io/kube-scheduler/blobs/sha256:6523efc24f16435b7507a67c2a1f21828c9d58531902856b294bf49d04b96bbe
        Request Version: HTTP/1.1
    Host: localhost:8080\r\n
    User-Agent: containerd/v2.1.4\r\n
    Accept: application/vnd.docker.image.rootfs.diff.tar.gzip, */*\r\n
    Accept-Encoding: zstd;q=1.0, gzip;q=0.8, deflate;q=0.5\r\n
    \r\n
    [Full request URI: http://localhost:8080/v2/registry.k8s.io/kube-scheduler/blobs/sha256:6523efc24f16435b7507a67c2a1f21828c9d58531902856b294bf49d04b96bbe]
```
